sentence,difficulty
" Ceci me paraît exagéré, répondis-je.",B2
"Ces animaux ne sont que des baleinoptères, pourvus de nageoires dorsales, et, de même que les cachalots, ils sont généralement plus petits que la baleine franche.",B2
"s’écria le Canadien, dont les regards ne quittaient pas l’Océan, elle se rapproche, elle vient dans les eaux du Nautilus.",B2
"» Puis, reprenant sa conversation : « Vous parlez, dit-il, du cachalot comme d’une petite bête.",B2
On cite cependant des cachalots gigantesques.,B2
Ce sont des cétacés intelligents.,B2
"Quelques-uns, dit-on, se couvrent d’algues et de fucus.",B2
"On les prend pour les îlots, on campe dessus, on s’y installe, on fait du feu…  On y bâtit des maisons, dit Conseil.",B2
"270  Oui, farceur, répondit Ned Land.",B2
"Puis, un beau jour, l’animal plonge et entraîne tous ses habitants au fond de l’abîme.",B2
" Comme dans les voyages de Simbad le marin, répliquai-je en riant.",B2
"maître Land, il paraît que vous aimez les histoires extraordinaires !",B2
Quels cachalots que les vôtres !,B2
J’espère que vous n’y croyez pas.,B2
" Monsieur le naturaliste, répondit sérieusement le Canadien, il faut tout croire de la part des baleines.",B2
" Comme elle marche, celle-ci !",B2
Comme elle se dérobe !,B2
 On prétend que ces animaux-là peuvent faire le tour du monde en quinze jours.,B2
 Je ne dis pas non.,B2
" Mais ce que vous ne savez sans doute pas, monsieur Aronnax, c’est que, au commencement du monde, les baleines nageaient plus rapidement encore.",B2
"vraiment, Ned !",B2
Et pourquoi cela ?,B2
" Parce qu’alors elles avaient la queue en travers, comme les poissons, c’est-à-dire que cette queue, comprimée verticalement, frappait l’eau de gauche à droite et de droite à gauche.",B2
"Mais le Créateur, s’apercevant qu’elles marchaient trop vite, leur tordit la queue, et depuis ce temps-là elles battent les flots de haut en bas, au détriment de leur rapidité.",B2
" Bon, Ned, dis-je en reprenant une expression du Canadien, faut-il vous croire ?",B2
" Pas trop, répondit Ned Land, et pas plus que si je vous disais qu’il existe des baleines longues de trois cents pieds et pesant cent mille livres.",B2
" C’est beaucoup, en effet, dis-je.",B2
"Cependant il faut avouer que certains cétacés acquièrent un développement considérable, puisque, dit-on, ils fournissent jusqu’à cent vingt tonnes d’huile.",B2
" Pour ça, je l’ai vu, dit le Canadien.",B2
" Je le crois volontiers, Ned, comme je crois que certaines baleines égalent en grosseur cent éléphants.",B2
Jugez des effets produits par une telle masse lancée à toute vitesse.,B2
" Est-il vrai, demanda Conseil, qu’elles peuvent couler des navires ?",B2
" Des navires, je ne le crois pas, répondis-je.",B2
"On raconte cependant qu’en 1820, précisément dans ces mers du Sud, une baleine se précipita sur l’Essex et le fit reculer avec une vitesse de quatre mètres par seconde.",B2
"Des lames pénétrèrent par l’arrière, et l’Essex sombra presque aussitôt.",B2
» Ned me regarda d’un air narquois.,B2
"« Pour mon compte, dit-il, j’ai reçu un coup de queue de baleine,  dans mon canot, cela va sans dire.",B2
"Mes compagnons et moi, nous avons été lancés à une hauteur de six mètres.",B2
"Mais auprès de la baleine de monsieur le professeur, la mienne n’était qu’un baleineau.",B2
 Est-ce que ces animaux-là vivent longtemps !,B2
"271  Mille ans, répondit le Canadien sans hésiter.",B2
" Et comment le savez-vous, Ned ?",B2
 Parce qu’on le dit.,B2
 Et pourquoi le dit-on ?,B2
 Parce qu’on le sait.,B2
" Non, Ned, on ne le sait pas, mais on le suppose, et voici le raisonnement sur lequel on s’appuie : Il y a quatre cents ans, lorsque les pêcheurs chassèrent pour la première fois les baleines, ces animaux avaient une taille supérieure à celle qu’ils acquièrent aujourd’hui.",B2
"On suppose donc, assez logiquement, que l’infériorité des baleines actuelles vient de ce qu’elles n’ont pas eu le temps d’atteindre leur complet développement.",B2
C’est ce qui a fait dire à Buffon que ces cétacés pouvaient et devaient même vivre mille ans.,B2
Vous entendez ?,B2
» Ned Land n’entendait pas.,B2
Il n’écoutait plus.,B2
La baleine s’approchait toujours.,B2
Il la dévorait des yeux.,B2
« Ah !,B2
"s’écria-t-il, ce n’est plus une baleine, c’est dix, c’est vingt, c’est un troupeau tout entier !",B2
Et ne pouvoir rien faire !,B2
Être là pieds et poings liés !,B2
" Mais, ami Ned, dit Conseil, pourquoi ne pas demander au capitaine Nemo la permission de chasser ?… » Conseil n’avait pas achevé sa phrase, que Ned Land s’était affalé par le panneau et courait à la recherche du capitaine.",B2
"Quelques instants après, tous deux reparaissaient sur la plate-forme.",B2
Le capitaine Nemo observa le troupeau de cétacés qui s’ébattait sur les eaux à un mille du Nautilus.,B2
"« Ce sont des baleines australes, dit-il.",B2
Il y a là la fortune d’une flotte de baleiniers.,B2
" Eh bien, monsieur, demanda le Canadien, ne pourrais-je leur donner la chasse, ne fût-ce que pour ne pas oublier mon ancien métier de harponneur ?",B2
" À quoi bon, répondit le capitaine Nemo, chasser uniquement pour détruire ?",B2
Nous n’avons que faire d’huile de baleine à bord.,B2
" Cependant, monsieur, reprit le Canadien, dans la mer Rouge, vous nous avez autorisés à poursuivre un dugong.",B2
Il s’agissait alors de procurer de la viande fraîche à mon équipage.,B2
"Ici, ce serait tuer pour tuer.",B2
"Je sais bien que c’est un privilège réservé à l’homme, mais je n’admets pas ces passe-temps meurtriers.",B2
"En détruisant la baleine australe comme la baleine franche, êtres inoffensifs et bons, vos pareils, maître Land, commettent une action blâmable.",B2
"C’est ainsi qu’ils ont déjà dépeuplé toute la baie de Baffin, et qu’ils anéantiront une classe d’animaux utiles.",B2
Laissez donc tranquilles ces malheureux cétacés.,B2
"Ils ont bien assez de leurs ennemis naturels, les cachalots, les espadons et les scies, sans que vous vous en mêliez.",B2
272 Je laisse à imaginer la figure que faisait le Canadien pendant ce cours de morale.,B2
"Donner de semblables raisons à un chasseur, c’était perdre ses paroles.",B2
Ned Land regardait le capitaine Nemo et ne comprenait évidemment pas ce qu’il voulait lui dire.,B2
Cependant le capitaine avait raison : l’acharnement barbare et inconsidéré des pêcheurs fera disparaître un jour la dernière baleine de l’Océan.,B2
"Ned Land siffla entre les dents son Yankee doodle, fourra ses mains dans ses poches et nous tourna le dos.",B2
"Cependant le capitaine Nemo observait le troupeau de cétacés, et s’adressant à moi : « J’avais raison de prétendre que, sans compter l’homme, les baleines ont assez d’autres ennemis naturels.",B2
Celles-ci vont avoir affaire à forte partie avant peu.,B2
"Apercevez-vous, monsieur Aronnax, à huit milles sous le vent, ces points noirâtres qui sont en mouvement ?",B2
" Oui, capitaine, répondis-je.",B2
" Ce sont des cachalots, animaux terribles, que j’ai quelquefois rencontrés par troupes de deux à trois cents.",B2
"Quant à ceux-là, bêtes cruelles et malfaisantes, on a raison de les exterminer.",B2
» Le Canadien se retourna vivement à ces derniers mots.,B2
"« Eh bien, capitaine, dis-je, il est temps encore, dans l’intérêt même des baleines…  Inutile de s’exposer, monsieur le professeur.",B2
Le Nautilus suffira à disperser ces cachalots.,B2
"Il est armé d’un éperon d’acier qui vaut bien le harpon de maître Land, j’imagine ?",B2
» Le Canadien ne se gêna pas pour hausser les épaules.,B2
Attaquer des cétacés à coups d’éperon !,B2
Qui avait jamais entendu parler de cela ?,B2
"« Attendez, monsieur Aronnax, dit le capitaine Nemo.",B2
Nous vous montrerons une chasse que vous ne connaissez pas encore.,B2
Pas de pitié pour ces féroces cétacés.,B2
Ils ne sont que bouche et dents !,B2
» Bouche et dents !,B2
"On ne pouvait mieux peindre le cachalot macrocéphale, dont la taille dépasse quelquefois vingt-cinq mètres.",B2
La tête énorme de ce cétacé occupe environ le tiers de son corps.,B2
"Mieux armé que la baleine, dont la mâchoire supérieure est seulement garnie de fanons, il est muni de vingt- cinq grosses dents, hautes de vingt centimètres, cylindriques et coniques à leur sommet, et qui pèsent deux livres chacune.",B2
"C’est à la partie supérieure de cette énorme tête et dans de grandes cavités séparées par des cartilages, que se trouvent trois à quatre cents kilogrammes de cette huile précieuse, dite « blanc de baleine ».",B2
"Le cachalot est un animal disgracieux, plutôt têtard que poisson, suivant la remarque de Frédol.",B2
"Il est mal construit, étant pour ainsi dire « manqué » dans toute la partie gauche de sa charpente, et n’y voyant guère que de l’œil droit.",B2
273 Cependant le monstrueux troupeau s’approchait toujours.,B2
Il avait aperçu les baleines et se préparait à les attaquer.,B2
"On pouvait préjuger d’avance la victoire des cachalots, non seulement parce qu’ils sont mieux bâtis pour l’attaque que leurs inoffensifs adversaires, mais aussi parce qu’ils peuvent rester plus longtemps sous les flots, sans venir respirer à leur surface.",B2
Il n’était que temps d’aller au secours des baleines.,B2
Le Nautilus se mit entre deux eaux.,B2
"Conseil, Ned et moi, nous prîmes place devant les vitres du salon.",B2
Le capitaine Nemo se rendit près du timonier pour manœuvrer son appareil comme un engin de destruction.,B2
Bientôt je sentis les battements de l’hélice se précipiter et notre vitesse s’accroître.,B2
Le combat était déjà commencé entre les cachalots et les baleines lorsque le Nautilus arriva.,B2
Il manœuvra de manière à couper la troupe de macrocéphales.,B2
"Ceux-ci, tout d’abord, se montrèrent peu émus à la vue du nouveau monstre qui se mêlait à la bataille.",B2
Mais bientôt ils durent se garer de ses coups.,B2
Quelle lutte !,B2
"Ned Land lui-même, bientôt enthousiasmé, finit par battre des mains.",B2
"Le Nautilus n’était plus qu’un harpon formidable, brandi par la main de son capitaine.",B2
"Il se lançait contre ces masses charnues et les traversait de part en part, laissant après son passage deux grouillantes moitiés d’animal.",B2
"Les formidables coups de queue qui frappaient ses flancs, il ne les sentait pas.",B2
"Les chocs qu’il produisait, pas davantage.",B2
"Un cachalot exterminé, il courait à un autre, virant sur place pour ne pas manquer sa proie, allant de l’avant, de l’arrière, docile à son gouvernail, plongeant quand le cétacé s’enfonçait dans les couches profondes, remontant avec lui lorsqu’il revenait à la surface, le frappant de plein ou d’écharpe, le coupant ou le déchirant, et dans toutes les directions et sous toutes les allures, le perçant de son terrible éperon.",B2
Quel carnage !,B2
quels bruits à la surface des flots !,B2
quels sifflements aigus et quels ronflements particuliers à ces animaux épouvantés !,B2
"Au milieu de ces couches ordinairement si paisibles, leur queue créait de véritables houles.",B2
"Pendant une heure se prolongea cet homérique massacre, auquel les macrocéphales ne pouvaient se soustraire.",B2
"Plusieurs fois, dix ou douze réunis essayèrent d’écraser le Nautilus sous leur masse.",B2
"On voyait, à la vitre, leur gueule énorme pavée de dents, leur œil formidable.",B2
"Ned Land, qui ne se possédait plus, les menaçait et les injuriait.",B2
"On sentait qu’ils se cramponnaient à notre appareil, comme des chiens qui coiffent un ragot sous les taillis.",B2
"Mais le Nautilus, forçant son hélice, les emportait, les entraînait ou les ramenait vers le niveau supérieur des eaux, sans se soucier ni de leur poids énorme ni de leurs puissantes étreintes.",B2
"274 Enfin la masse des cachalots s’éclaircit, les flots redevinrent tranquilles.",B2
Je sentis que nous remontions à la surface de l’Océan.,B2
"Le panneau fut ouvert, et nous nous précipitâmes sur la plate-forme.",B2
La mer était couverte de cadavres mutilés.,B2
"Une explosion formidable n’eût pas divisé, déchiré, déchiqueté avec plus de violence ces masses charnues.",B2
"Nous flottions au milieu de corps gigantesques, bleuâtres sur le dos, blanchâtres sous le ventre, et tout bossués d’énormes protubérances.",B2
Quelques cachalots épouvantés fuyaient à l’horizon.,B2
"Les flots étaient teints en rouge sur un espace de plusieurs milles, et le Nautilus nageait au milieu d’une mer de sang.",B2
Le capitaine Nemo nous rejoignit.,B2
"« Eh bien, maître Land ?",B2
" Eh bien, monsieur, répondit le Canadien, chez lequel l’enthousiasme s’était calmé, c’est un spectacle terrible, en effet.",B2
"Mais je ne suis pas un boucher, je suis un chasseur, et ceci n’est qu’une boucherie.",B2
" C’est un massacre d’animaux malfaisants, répondit le capitaine, et le Nautilus n’est pas un couteau de boucher.",B2
" J’aime mieux mon harpon, répliqua le Canadien.",B2
" Chacun son arme, » répondit le capitaine, en regardant fixement Ned Land.",B2
Je craignais que celui-ci ne se laissât emporter à quelque violence qui aurait eu des conséquences déplorables.,B2
Mais sa colère fut détournée par la vue d’une baleine que le Nautilus accostait en ce moment.,B2
L’animal n’avait pu échapper à la dent des cachalots.,B2
"Je reconnus la baleine australe, à tête déprimée, qui est entièrement noire.",B2
"Anatomiquement elle se distingue de la baleine blanche et du Nord-Caper par la soudure des sept vertèbres cervicales, et elle compte deux côtes de plus que ses congénères.",B2
"Le malheureux cétacé, couché sur le flanc, le ventre troué de morsures, était mort.",B2
Au bout de sa nageoire mutilée pendait encore un petit baleineau qu’il n’avait pu sauver du massacre.,B2
Sa bouche ouverte laissait couler l’eau qui murmurait comme un ressac à travers ses fanons.,B2
Le capitaine Nemo conduisit le Nautilus près du cadavre de l’animal.,B2
"Deux de ses hommes montèrent sur le flanc de la baleine, et je vis, non sans étonnement, qu’ils retiraient de ses mamelles tout le lait qu’elles contenaient, c’est-à-dire la valeur de deux à trois tonneaux.",B2
Le capitaine m’offrit une tasse de ce lait encore chaud.,B2
Je ne pus m’empêcher de lui marquer ma répugnance pour ce breuvage.,B2
Il m’assura que ce lait était excellent et qu’il ne se distinguait en aucune façon du lait de vache.,B2
275 Je le goûtai et je fus de son avis.,B2
"C’était donc pour nous une réserve utile, car ce lait, sous la forme de beurre salé ou de fromage, devait apporter une agréable variété à notre ordinaire.",B2
"De ce jour-là, je remarquai avec inquiétude que les dispositions de Ned Land envers le capitaine Nemo devenaient de plus en plus mauvaises, et je résolus de surveiller de près les faits et gestes du Canadien.",B2
276 CHAPITRE XIII La banquise Le Nautilus avait repris son imperturbable direction vers le sud.,B2
Il suivait le cinquantième méridien avec une vitesse considérable.,B2
Voulait-il donc atteindre le pôle ?,B2
"Je ne le pensais pas, car jusqu’ici toutes les tentatives pour s’élever jusqu’à ce point du globe avaient échoué.",B2
"La saison, d’ailleurs, était déjà fort avancée, puisque le 13 mars des terres antarctiques correspond au 13 septembre des régions boréales, qui commence la période équinoxiale.",B2
"Le 14 mars, j’aperçus des glaces flottantes par 55° de latitude, simples débris blafards de vingt à vingt-cinq pieds, formant des écueils sur lesquels la mer déferlait.",B2
Le Nautilus se maintenait à la surface de l’Océan.,B2
"Ned Land, ayant déjà pêché dans les mers arctiques, était familiarisé avec ce spectacle des icebergs.",B2
"Conseil et moi, nous l’admirions pour la première fois.",B2
"Dans l’atmosphère, vers l’horizon du sud, s’étendait une bande blanche d’un éblouissant aspect.",B2
Les baleiniers anglais lui ont donné le nom de « ice- blinck.,B2
"» Quelque épais que soient les nuages, ils ne peuvent l’obscurcir.",B2
Elle annonce la présence d’un pack ou banc de glace.,B2
"En effet, bientôt apparurent des blocs plus considérables dont l’éclat se modifiait suivant les caprices de la brume.",B2
"Quelques-unes de ces masses montraient des veines vertes, comme si le sulfate de cuivre en eût tracé les lignes ondulées.",B2
"D’autres, semblables à d’énormes améthystes, se laissaient pénétrer par la lumière.",B2
Celles-ci réverbéraient les rayons du jour sur les mille facettes de leurs cristaux.,B2
"Celles-là, nuancées des vifs reflets du calcaire, auraient suffi à la construction de toute une ville de marbre.",B2
"Plus nous descendions au sud, plus ces îles flottantes gagnaient en nombre et en importance.",B2
Les oiseaux polaires y nichaient par milliers.,B2
"C’étaient des pétrels, des damiers, des puffins, qui nous assourdissaient de leurs cris.",B2
"Quelques-uns, prenant le Nautilus pour le cadavre d’une baleine, venaient s’y reposer et piquaient de coups de bec sa tôle sonore.",B2
Pendant cette navigation au milieu des glaces le capitaine Nemo se tint souvent sur la plate-forme.,B2
Il observait avec attention ces parages abandonnés.,B2
Je voyais son calme regard s’animer parfois.,B2
"Se disait-il que dans ces mers polaires interdites à l’homme, il était là chez lui, maître de ces infranchissables espaces ?",B2
Mais il ne parlait pas.,B2
"Il restait immobile, ne revenant à lui que lorsque ses instincts de manœuvrier reprenaient le dessus.",B2
"Dirigeant alors son Nautilus avec une adresse consommée, il évitait habilement le choc de ces masses dont quelques- unes mesuraient une longueur de plusieurs milles sur une hauteur qui variait de soixante-dix à quatre-vingts mètres.",B2
Souvent l’horizon paraissait,B2
277 entièrement fermé.,B2
"À la hauteur du soixantième degré de latitude, toute passe avait disparu.",B2
"Mais le capitaine Nemo, cherchant avec soin, trouvait bientôt quelque étroite ouverture par laquelle il se glissait audacieusement, sachant bien cependant, qu’elle se refermerait derrière lui.",B2
"Ce fut ainsi que le Nautilus, guidé par cette main habile, dépassa toutes ces glaces, classées, suivant leur forme ou leur grandeur, avec une précision qui enchantait Conseil : iceberg ou montagnes, icefields ou thamps unis et sans limites, drift-ice ou glaces flottantes, packs ou champs brisés, nommés palchs quand ils sont circulaires, et streams lorsqu’ils sont faits de morceaux allongés.",B2
La température était assez basse.,B2
"Le thermomètre, exposé à l’air extérieur, marquait deux ou trois degrés au-dessous de zéro.",B2
"Mais nous étions chaudement habillés de fourrure, dont les phoques ou les ours marins avaient fait les frais.",B2
"L’intérieur du Nautilus, régulièrement chauffé par ses appareils électriques, défiait les froids les plus intenses.",B2
"D’ailleurs, il lui eût suffi de s’enfoncer à quelques mètres au-dessous des flots pour y trouver une température supportable.",B2
"Deux mois plus tôt, nous aurions joui sous cette latitude d’un jour perpétuel ; mais déjà la nuit se faisait pendant trois ou quatre heures, et plus tard elle devait jeter six mois d’ombre sur ces régions circum polaires.",B2
"Le 15 mars, la latitude des îles New-Sethland et des Orkney du Sud fut dépassée.",B2
"Le capitaine m’apprit qu’autrefois de nombreuses tribus de phoques habitaient ces terres ; mais les baleiniers anglais et américains, dans leur rage de destruction, massacrant les adultes et les femelles pleines, là où existait l’animation de la vie, avaient laissé après eux le silence de la mort.",B2
"Le 16 mars, vers huit heures du matin, le Nautilus, suivant le cinquante- cinquième méridien, coupa le cercle polaire antarctique.",B2
Les glaces nous entouraient de toutes parts et fermaient l’horizon.,B2
Cependant le capitaine Nemo marchait de passe en passe et s’élevait toujours.,B2
« Mais où va-t-il ?,B2
" Devant lui, répondait Conseil.",B2
"Après tout, lorsqu’il ne pourra pas aller plus loin, il s’arrêtera.",B2
 Je n’en jurerais pas !,B2
"Et, pour être franc, j’avouerai que cette excursion aventureuse ne me déplaisait point.",B2
"À quel degré m’émerveillaient les beautés de ces régions nouvelles, je ne saurais l’exprimer.",B2
Les glaces prenaient des attitudes superbes.,B2
"Ici, leur ensemble formait une ville orientale, avec ses minarets et ses mosquées innombrables ; là, une cité écroulée, et comme jetée à terre par une convulsion du sol.",B2
"Aspects incessamment variés par les obliques rayons du soleil, ou perdus dans les brumes grises au milieu des ouragans de neige.",B2
"278 Puis, de toutes parts des détonations, des éboulements, de grandes culbutes d’icebergs, qui changeaient le décor comme le paysage d’un diorama.",B2
"Lorsque le Nautilus était immergé au moment où se rompaient ces équilibres, le bruit se propageait sous les eaux avec une effrayante intensité, et la chute de ces masses créait de redoutables remous jusque dans les couches profondes de l’Océan.",B2
Le Nautilus roulait et tanguait alors comme un navire abandonné à la furie des éléments.,B2
"Souvent, ne voyant plus aucune issue, je pensais que nous étions définitivement prisonniers ; mais, l’instinct le guidant, sur le plus léger indice, le capitaine Nemo découvrait des passes nouvelles.",B2
Il ne se trompait jamais en observant les minces filets d’eau bleuâtre qui sillonnaient les icefields.,B2
Aussi ne mettais-je pas en doute qu’il n’eût aventuré déjà le Nautilus au milieu des mers antarctiques.,B2
"Cependant, dans la journée du 16 mars, les champs de glace nous barraient absolument la route.",B2
"Ce n’était pas encore la banquise, mais de vastes icefields cimentés par le froid.",B2
"Cet obstacle ne pouvait arrêter le capitaine Nemo, et il se lança contre l’icefield avec une effroyable violence.",B2
"Le Nautilus entrait comme un coin dans cette masse friable, et la divisait avec des craquements terribles.",B2
C’était l’antique bélier poussé par une puissance infinie.,B2
"Les débris de glace, haut projetés, retombaient en grêle autour de nous.",B2
"Par sa seule force d’impulsion, notre appareil se creusait un chenal.",B2
"Quelquefois, emporté par son élan, il montait sur le champ de glace et l’écrasait de son poids, ou par instants, enfourné sous l’icefield, il le divisait par un simple mouvement de tangage qui produisait de larges déchirures.",B2
"Pendant ces journées, de violents grains nous assaillirent.",B2
"Par certaines brumes épaisses, on ne se fût pas vu d’une extrémité de la plate-forme à l’autre.",B2
Le vent sautait brusquement à tous les points du compas.,B2
La neige s’accumulait en couches si dures qu’il fallait la briser à coups de pic.,B2
"Rien qu’à la température de cinq degrés au-dessous de zéro, toutes les parties extérieures du Nautilus se recouvraient de glaces.",B2
"Un gréement n’aurait pu se manœuvrer, car tous les garants eussent été engagés dans la gorge des poulies.",B2
Un bâtiment sans voiles et mû par un moteur électrique qui se passait de charbon pouvait seul affronter d’aussi hautes latitudes.,B2
"Dans ces conditions, le baromètre se tint généralement très bas.",B2
Il tomba même à 73° 5’.,B2
Les indications de la boussole n’offraient plus aucune garantie.,B2
"Ses aiguilles affolées marquaient des directions contradictoires, en s’approchant du pôle magnétique méridional, qui ne se confond pas avec le sud du monde.",B2
"En effet, suivant Hansten, ce pôle est situé à peu près par 70° de latitude et 130° de longitude, et d’après les observations de Duperré, par 135° de longitude et 70° 30’de latitude.",B2
Il fallait faire alors des observations nombreuses sur les compas transportés à différentes parties du,B2
279 navire et prendre une moyenne.,B2
"Mais souvent, on s’en rapportait à l’estime pour relever la route parcourue, méthode peu satisfaisante au milieu de ces passes sinueuses dont les points de repère changent incessamment.",B2
"Enfin, le 18 mars, après vingt assauts inutiles, le Nautilus se vit définitivement enrayé.",B2
"Ce n’était plus ni les streams, ni les palks, ni les icefields, mais une interminable et immobile barrière formée de montagnes soudées entre elles.",B2
« La banquise !,B2
» me dit le Canadien.,B2
"Je compris que pour Ned Land comme pour tous les navigateurs qui nous avaient précédés, c’était l’infranchissable obstacle.",B2
"Le soleil ayant un instant paru vers midi, le capitaine Nemo obtint une observation assez exacte qui donnait à notre situation 51° 30’de longitude et 67° 39’de latitude méridionale.",B2
C’était déjà un point avancé des régions antarctiques.,B2
"De mer, de surface liquide, il n’y avait plus apparence devant nos yeux.",B2
"Sous l’éperon du Nautilus s’étendait une vaste plaine tourmentée, enchevêtrée de blocs confus, avec tout ce pêle-mêle capricieux qui caractérise la surface d’un fleuve quelque temps avant la débâcle des glaces, mais sur des proportions gigantesques.",B2
"Çà et là, des pics aigus, des aiguilles déliées s’élevant à une hauteur de deux cents pieds ; plus loin, une suite de falaises taillées à pic et revêtues de teintes grisâtres, vastes miroirs qui reflétaient quelques rayons de soleil à demi noyés dans les brumes.",B2
"Puis, sur cette nature désolée, un silence farouche, à peine rompu par le battement d’ailes des pétrels ou des puffins.",B2
