sentence,difficulty
"Elles meurent ainsi à l’air libre, et, au bout de dix jours, elles se trouvent dans un état satisfaisant de putréfaction.",B2
On les plonge alors,B2
"183 dans de vastes réservoirs d’eau de mer, puis on les ouvre et on les lave.",B2
C’est à ce moment que commence le double travail des rogueurs.,B2
"D’abord ils séparent les plaques de nacre connues dans le commerce sous le nom de franche argentée, de bâtarde blanche et de bâtarde noire, qui sont livrées par caisses de cent vingt-cinq à cent cinquante kilogrammes.",B2
"Puis ils enlèvent le parenchyme de l’huître, ils le font bouillir, et ils le tamisent afin d’en extraire jusqu’aux plus petites perles.",B2
 Le prix de ces perles varie suivant leur grosseur ?,B2
" Non seulement selon leur grosseur, répondis-je, mais aussi selon leur forme, selon leur eau, c’est-à-dire leur couleur, et selon leur orient, c’est-à- dire cet éclat chatoyant et diapré qui les rend si charmantes à l’œil.",B2
"Les plus belles perles sont appelées perles-vierges ou parangons ; elles se forment isolément dans le tissu du mollusque ; elles sont blanches, souvent opaques, mais quelquefois d’une transparence opaline, et le plus communément sphérique ou pyriforme.",B2
"Sphériques, elles forment les bracelets ; pyriformes, des pendeloques, et, étant les plus précieuses, elles se vendent à la pièce.",B2
"Les autres perles adhèrent à la coquille de l’huître, et, plus irrégulières, elles se vendent au poids.",B2
"Enfin dans un ordre inférieur se classent les petites perles, connues sous le nom de semences ; elles se vendent à la mesure et servent plus particulièrement à exécuter des broderies sur les ornements d’église.",B2
" Mais ce travail, qui consiste à séparer les perles selon leur grosseur, doit être long et difficile ?",B2
dit le Canadien.,B2
" Non, mon ami.",B2
Ce travail se fait au moyen de onze tamis ou cribles percés d’un nombre variable de trous.,B2
Les perles qui restent dans les tamis qui comptent de vingt à quatre-vingts trous sont de premier ordre.,B2
Celles qui ne s’échappent pas des cribles percés de cent à huit cents trous sont de second ordre.,B2
Enfin les perles pour lesquelles l’on emploie les tamis percés de neuf cents à mille trous forment la semence.,B2
" C’est ingénieux, dit Conseil, et je vois que la division, le classement des perles s’opère mécaniquement.",B2
Et monsieur pourra-t-il nous dire ce que rapporte l’exploitation des bancs d’huîtres perlières ?,B2
" À s’en tenir au livre de Sirr, répondis-je, les pêcheries de Ceyland sont affermées annuellement pour la somme de trois millions de squales.",B2
 De francs !,B2
" Oui, de francs.",B2
Trois millions de francs !,B2
Mais je crois que ces pêcheries ne rapportent plus qu’elles rapportaient autrefois.,B2
"Il en est de même des pêcheries américaines, qui, sous le règne de Charles-Quint, produisaient quatre millions de francs, présentement réduits aux deux tiers.",B2
"En somme, on peut évaluer à neuf millions de francs le rendement général de l’exploitation des perles.",B2
"184  Mais, demanda Conseil, est-ce que l’on ne cite pas quelques perles célèbres qui ont été cotées à un très haut prix ?",B2
" Oui, mon garçon.",B2
On dit que César offrit à Servillia une perle estimée cent vingt mille francs de notre monnaie.,B2
" J’ai même entendu raconter, dit le Canadien, qu’une certaine dame antique buvait des perles dans son vinaigre.",B2
" Cléopâtre, riposta Conseil.",B2
" Ça devait être mauvais, ajouta Ned Land.",B2
" Détestable, ami Ned, répondit Conseil ; mais un petit verre de vinaigre qui coûte quinze cent mille francs, c’est d’un joli prix.",B2
" Je regrette de ne pas avoir épousé cette dame, dit le Canadien en manœuvrant son bras d’un air peu rassurant.",B2
 Ned Land l’époux de Cléopâtre !,B2
" Mais j’ai dû me marier, Conseil, répondit sérieusement le Canadien, et ce n’est pas ma faute si l’affaire n’a pas réussi.",B2
"J’avais même acheté un collier de perles à Kate Tender, ma fiancée, qui, d’ailleurs, en a épousé un autre.",B2
"Eh bien, ce collier ne m’avait pas coûté plus d’un dollar et demi, et cependant,  monsieur le professeur voudra bien me croire,  les perles qui le composaient n’auraient pas passé par le tamis de vingt trous.",B2
" Mon brave Ned, répondis-je en riant, c’étaient des perles artificielles, de simples globules de verre enduits à l’intérieur d’essence d’Orient.",B2
"cette essence d’Orient, répondit le Canadien, cela doit coûter cher ?",B2
 Si peu que rien !,B2
"Ce n’est autre chose que la substance argentée de l’écaille de l’ablette, recueillie dans l’eau et conservée dans l’ammoniaque.",B2
Elle n’a aucune valeur.,B2
" C’est peut-être pour cela que Kate Tender en a épousé un autre, répondit philosophiquement maître Land.",B2
" Mais, dis-je, pour en revenir aux perles de haute valeur, je ne crois pas que jamais souverain en ait possédé une supérieure à celle du capitaine Nemo.",B2
" Celle-ci, dit Conseil, en montrant le magnifique bijou enfermé sous sa vitrine.",B2
" Certainement, je ne me trompe pas en lui assignant une valeur de deux millions de…  Francs !",B2
dit vivement Conseil.,B2
" Oui, dis-je, deux millions de francs, et, sans doute, elle n’aura coûté au capitaine que la peine de la ramasser.",B2
"s’écria Ned Land, qui dit que demain, pendant notre promenade, nous ne rencontrerons passa pareille ?",B2
 Et pourquoi pas ?,B2
185  À quoi des millions nous serviraient-ils à bord du Nautilus ?,B2
" À bord, non, dit Ned Land, mais… ailleurs.",B2
fit Conseil en secouant la tête.,B2
" Au fait, dis-je, maître Land a raison.",B2
"Et si nous rapportons jamais en Europe ou en Amérique une perle de quelques millions, voilà du moins qui donnera une grande authenticité et, en même temps, un grand prix au récit de nos aventures.",B2
" Je le crois, dit le Canadien.",B2
" Mais, dit Conseil, qui revenait toujours au côté instructif des choses, est-ce que cette pêche des perles est dangereuse ?",B2
" Non, répondis-je vivement, surtout si l’on prend certaines précautions.",B2
 Que risque-t-on dans ce métier ?,B2
dit Ned Land.,B2
D’avaler quelques gorgées d’eau de mer ?,B2
" Comme vous dites, Ned.",B2
"À propos, dis-je en essayant de prendre le ton dégagé du capitaine Nemo, est-ce que vous avez peur des requins, brave Ned ?",B2
" Moi, répondit le Canadien, un harponneur de profession !",B2
C’est mon métier de me moquer d’eux !,B2
" Il ne s’agit pas, dis-je, de les pêcher avec un émerillon, de les hisser sur le pont d’un navire, de leur couper la queue à coups de hache, de leur ouvrir le ventre, de leur arracher le cœur et de le jeter à la mer.",B2
" Alors, il s’agit de… ?",B2
 Dans l’eau ?,B2
" Ma foi, avec un bon harpon !",B2
"Vous savez, monsieur, ces requins, ce sont des bêtes assez mal façonnées.",B2
"Il faut qu’elles se retournent sur le ventre pour vous happer, et pendant ce temps… » Ned Land avait une manière de prononcer le mot « happer » qui donnait froid.",B2
"« Eh bien, et toi, Conseil, que penses-tu de ces squales ?",B2
" Moi, dit Conseil, je serai franc avec monsieur.",B2
" À la bonne heure, pensai-je.",B2
" Si monsieur affronte les requins, dit Conseil, je ne vois pas pourquoi son fidèle domestique ne les affronterait pas avec lui !",B2
186 CHAPITRE III Une perle de dix millions La nuit arriva.,B2
Je me couchai.,B2
Je dormis assez mal.,B2
"Les squales jouèrent un rôle important dans mes rêves, et je trouvai très juste et très injuste à la fois cette étymologie qui fait venir le mot requin du mot « requiem ».",B2
"Le lendemain, à quatre heures du matin, je fus réveillé par le stewart que le capitaine Nemo avait spécialement mis à mon service.",B2
"Je me levai rapidement, je m’habillai et je passai dans le salon.",B2
Le capitaine Nemo m’y attendait.,B2
"« Monsieur Aronnax, me dit-il, êtes-vous prêt à partir ?",B2
 Je suis prêt.,B2
 Veuillez me suivre.,B2
" Et mes compagnons, capitaine ?",B2
 Ils sont prévenus et nous attendent.,B2
 N’allons-nous pas revêtir nos scaphandres ?,B2
"Je n’ai pas laissé le Nautilus approcher de trop près cette côte, et nous sommes assez au large du banc de Manaar ; mais j’ai fait parer le canot qui nous conduira au point précis de débarquement et nous épargnera un assez long trajet.",B2
"Il emporte nos appareils de plongeurs, que nous revêtirons au moment où commencera cette exploration sous-marine.",B2
"» Le capitaine Nemo me conduisit vers l’escalier central, dont les marches aboutissaient à la plate-forme.",B2
"Ned et Conseil se trouvaient là, enchantés de « la partie de plaisir » qui se préparait.",B2
"Cinq matelots du Nautilus, les avirons armés, nous attendaient dans le canot qui avait été bossé contre le bord.",B2
La nuit était encore obscure.,B2
Des plaques de nuages couvraient le ciel et ne laissaient apercevoir que de rares étoiles.,B2
Je portais mes yeux du côté de la terre ; mais je ne vis qu’une ligne trouble qui fermait les trois quarts de l’horizon du sud-ouest au nord-ouest.,B2
"Le Nautilus, ayant remonté pendant la nuit la côte Occidentale de Ceylan, se trouvait à l’ouest de la baie, ou plutôt de ce golfe formé par cette terre et l’île de Manaar.",B2
"Là, sous les sombres eaux, s’étendait le banc de pintadines, inépuisable champ de perles dont la longueur dépasse vingt milles.",B2
"Le capitaine Nemo, Conseil, Ned Land et moi, nous prîmes place à l’arrière du canot.",B2
Le patron de l’embarcation se mit à la barre ; ses quatre compagnons appuyèrent sur leurs avirons ; la bosse fut larguée et nous débordâmes.,B2
Le canot se dirigea vers le sud.,B2
Ses nageurs ne se pressaient pas.,B2
"J’observai que leurs coups d’aviron vigoureusement engagés sous l’eau, ne se succédaient que de dix secondes en dix secondes, suivant la méthode",B2
187 généralement usitée dans les marines de guerre.,B2
"Tandis que l’embarcation courait sur son erre, les gouttelettes liquides frappaient en crépitant le fond noir des flots comme des bavures de plomb fondu ; une petite houle, venue du large, imprimait au canot un léger roulis, et quelques crêtes de lames clapotaient à son avant.",B2
Nous étions silencieux.,B2
À quoi songeait le capitaine Nemo ?,B2
"Peut- être à cette terre dont il s’approchait, et qu’il trouvait trop près de lui, contrairement à l’opinion du Canadien, auquel elle semblait encore trop éloignée.",B2
"Quant à Conseil, il était là en simple curieux.",B2
"Vers cinq heures et demie, les premières teintes de l’horizon accusèrent plus nettement la ligne supérieure de la côte.",B2
"Assez plate dans l’est, elle se renflait un peu vers le sud.",B2
"Cinq milles la séparaient encore, et son rivage se confondait avec les eaux brumeuses.",B2
Entre elle et nous la mer était déserte.,B2
"Pas un bateau, pas un plongeur.",B2
Solitude profonde sur ce lieu de rendez-vous des pêcheurs de perles.,B2
"Ainsi que le capitaine Nemo me l’avait fait observer, nous arrivions un mois trop tôt dans ces parages.",B2
"À six heures, le jour se fit subitement, avec cette rapidité particulière aux régions tropicales, qui ne connaissent ni l’aurore ni le crépuscule.",B2
"Les rayons solaires percèrent le rideau de nuages amoncelés sur l’horizon oriental, et l’astre radieux s’éleva rapidement.",B2
"Je vis distinctement la terre, avec quelques arbres épars çà et là.",B2
"Le canot s’avança vers l’île de Manaar, qui s’arrondissait dans le sud.",B2
Le capitaine Nemo s’était levé de son banc et observait la mer.,B2
"Sur un signe de lui, l’ancre fut mouillée, et la chaîne courut à peine, car le fond n’était pas à plus d’un mètre, et il formait en cet endroit l’un des plus hauts points du banc de pintadines.",B2
"Le canot évita aussitôt, sous la poussée du jusant qui portait au large.",B2
"« Nous voici arrivés, monsieur Aronnax, dit alors le capitaine Nemo.",B2
Vous voyez cette baie resserrée.,B2
"C’est ici même que dans un mois se réuniront les nombreux bateaux de pêche des exploitants, et ce sont ces eaux que leurs plongeurs iront audacieusement fouiller.",B2
Cette baie est heureusement disposée pour ce genre de pêche.,B2
"Elle est abritée des vents les plus forts, et la mer n’y est jamais très houleuse, circonstance favorable au travail des plongeurs.",B2
"Nous allons maintenant revêtir nos scaphandres, et nous commencerons notre promenade.",B2
"» Je ne répondis rien, et, tout en regardant ces flots suspects, aidé des matelots de l’embarcation, je commençai à revêtir mon lourd vêtement de mer.",B2
Le capitaine Nemo et mes deux compagnons s’habillaient aussi.,B2
Aucun des hommes du Nautilus ne devait nous accompagner dans cette nouvelle excursion.,B2
"188 Bientôt nous fûmes emprisonnés jusqu’au cou dans vêtement de caoutchouc, et des bretelles fixèrent sur notre dos les appareils à air.",B2
"Quant aux appareils Ruhmkorff, il n’en était pas question.",B2
"Avant d’introduire ma tête dans sa capsule de cuivre, j’en fis l’observation au capitaine.",B2
"« Ces appareils nous seraient inutiles, me répondit le capitaine.",B2
"Nous n’irons pas à de grandes profondeurs, et les rayons solaires suffiront à éclairer notre marche.",B2
"D’ailleurs, il n’est pas prudent d’emporter sous ces eaux une lanterne électrique.",B2
Son éclat pourrait attirer inopinément quelque dangereux habitant de ces parages.,B2
"» Pendant que le capitaine Nemo prononçait ces paroles, je me retournai vers Conseil et Ned Land ; mais ces deux amis avaient déjà emboîté leur tête dans la calotte métallique, et ils ne pouvaient ni entendre ni répondre.",B2
Une dernière question me restait à adresser au capitaine Nemo.,B2
"« Et nos armes, lui demandai-je, nos fusils ?",B2
 Des fusils !,B2
à quoi bon ?,B2
"Vos montagnards n’attaquent-ils pas l’ours un poignard à la main, et l’acier n’est-il pas plus sûr que le plomb ?",B2
Voici une lame solide.,B2
Passez-la à votre ceinture et partons.,B2
» Je regardai mes compagnons.,B2
"Ils étaient armés comme nous, et, de plus, Ned Land brandissait un énorme harpon qu’il avait déposé dans le canot avant de quitter le Nautilus.",B2
"Puis, suivant l’exemple du capitaine, je me laissai coiffer de la pesante sphère de cuivre, et nos réservoirs à air furent immédiatement mis en activité.",B2
"Un instant après, les matelots de l’embarcation nous débarquaient les uns après les autres, et, par un mètre et demi d’eau, nous prenions pied sur un sable uni.",B2
"Le capitaine Nemo nous fit un signe de la main, nous le suivîmes, et par une pente douce nous disparûmes sous les flots.",B2
"Là, les idées qui obsédaient mon cerveau m’abandonnèrent.",B2
Je redevins étonnamment calme.,B2
"La facilité de mes mouvements accrut ma confiance, et l’étrangeté du spectacle captiva mon imagination.",B2
Le soleil envoyait déjà sous les eaux une clarté suffisante.,B2
Les moindres objets restaient perceptibles.,B2
"Après dix minutes de marche, nous étions par cinq mètres d’eau, et le terrain devenait à peu près plat.",B2
"Sur nos pas, comme des compagnies de bécassines dans un marais, se levaient des volées de poissons curieux du genre des monoptères, dont les sujets n’ont d’autre nageoire que celle de la queue.",B2
"Je reconnus le javanais, véritable serpent long de huit décimètres, au ventre livide, que l’on confondrait facilement avec le congre sans les lignes d’or de ses flancs.",B2
"Dans le genre des stromatées, dont le corps est très comprimé et ovale, j’observai des parus aux couleurs éclatantes portant comme une faux leur nageoire dorsale, poissons comestibles qui, séchés et marinés, forment un mets excellent connu sous le nom de karawade ; puis des tranquebars,",B2
"189 appartenant au genre des apsiphoroïdes, dont le corps est recouvert d’une cuirasse écailleuse à huit pans longitudinaux.",B2
Cependant l’élévation progressive du soleil éclairait de plus en plus la masse des eaux.,B2
Le sol changeait peu à peu.,B2
"Au sable fin succédait une véritable chaussée de rochers arrondis, revêtus d’un tapis de mollusques et de zoophytes.",B2
"Parmi les échantillons de ces deux embranchements, je remarquai des placènes à valves minces et inégales, sortes d’ostracées particulières à la mer Rouge et à l’océan Indien, des lucines orangées à coquille orbi cul aire, des tarières subulées, quelques-unes de ces pourpres persiques qui fournissaient au Nautilus une teinture admirable, des rochers cornus, longs de onze centimètres, qui se dressaient sous les flots comme des mains prêtes à vous saisir, des turbinelles cornigères, toutes hérissées d’épines, des lingules hyantes, des anatines, coquillages comestibles qui alimentent les marchés de l’Hindoustan, des pélagies panopyres, légèrement lumineuses, et enfin d’admirables oculines flabelliformes, magnifiques éventails qui forment l’une des plus riches arborisations de ces mers.",B2
"Au milieu de ces plantes vivantes et sous les berceaux d’hydrophytes couraient de gauches légions d’articulés, particulièrement des ranines dentées, dont la carapace représente un triangle un peu arrondi, des birgues spéciales à ces parages, des parthénopes horribles, dont l’aspect répugnait aux regards.",B2
"Un animal non moins hideux que je rencontrai plusieurs fois, ce fut ce crabe énorme observé par M. Darwin, auquel la nature a donné l’instinct et la force nécessaires pour se nourrir de noix de coco ; il grimpe aux arbres du rivage, il fait tomber la noix qui se fend dans sa chute, et il l’ouvre avec ses puissantes pinces.",B2
"Ici, sous ces flots clairs, ce crabe courait avec une agilité sans pareille, tandis que des chélonées franches, de cette espèce qui fréquente les côtes du Malabar, se déplaçaient lentement entre les roches ébranlées.",B2
Vers sept heures nous arpentions enfin le banc de pintadines sur lequel des huîtres perlières se reproduisent par millions.,B2
"Ces mollusques précieux adhéraient aux rocs et y étaient fortement attachés par ce byssus de couleur brune qui ne leur permet pas de bouger : en quoi ces huîtres sont inférieures aux moules elles-mêmes, auxquelles la nature n’a pas refusé toute faculté de locomotion.",B2
"La pintadine meleagrina, la mère perle, dont les valves sont à peu près égales, se présente sous la forme d’une coquille arrondie, aux épaisses parois très rugueuses à l’extérieur.",B2
Quelques-unes de ces coquilles étaient feuilletées et sillonnées de bandes verdâtres qui rayonnaient de leur sommet.,B2
Elles appartenaient aux jeunes huîtres.,B2
"Les autres, à surface rude et noire, vieilles de dix ans et plus, mesuraient jusqu’à quinze centimètres de largeur.",B2
"190 Le capitaine Nemo me montra de la main cet amoncellement prodigieux de pintadines, et je compris que cette mine était véritablement inépuisable : car la force créatrice de la nature l’emporte sur l’instinct destructif de l’homme.",B2
"Ned Land, fidèle à cet instinct de destruction, se hâtait d’emplir des plus beaux mollusques un filet qu’il portait à son côté.",B2
Mais nous ne pouvions nous arrêter.,B2
"Il fallait suivre le capitaine, qui semblait se diriger par des sentiers connus de lui seul.",B2
"Le sol remontait sensiblement, et parfois mon bras, que j’élevais, dépassait la surface de la mer.",B2
Puis le niveau du banc se rabaissait capricieusement.,B2
Souvent nous tournions de hauts rocs effilés en pyramidions.,B2
"Dans leurs sombres anfractuosités, de gros crustacés, pointés sur leurs hautes pattes comme des machines de guerre, nous regardaient de leurs yeux fixes, et sous nos pieds rampaient des myrianes, des glycères, des aricies et des annélides, qui allongeaient démesurément leurs antennes et leurs cyrrhes tentaculaires.",B2
"En ce moment s’ouvrit devant nous une vaste grotte, creusée dans un pittoresque entassement de rochers tapissés de toutes les hautes-lisses de la flore sous-marine.",B2
D’abord cette grotte me parut profondément obscure.,B2
Les rayons solaires semblaient s’y éteindre par dégradations successives.,B2
Sa vague transparence n’était plus que la lumière noyée.,B2
Le capitaine Nemo y entra.,B2
Nous après lui.,B2
Mes yeux s’accoutumèrent bientôt à ces ténèbres relatives.,B2
"Je distinguai les retombées si capricieusement contournées de la voûte que supportaient des piliers naturels, largement assis sur base granitique, comme les lourdes colonnes de l’architecture toscane.",B2
Pourquoi notre incompréhensible guide nous entraînait-il au fond de cette crypte sous-marine ?,B2
J’allais le savoir avant peu.,B2
"Après avoir descendu une pente assez raide, nos pieds foulèrent le fond d’une sorte de puits circulaire.",B2
"Là, le capitaine Nemo s’arrêta, et de la main il nous indiqua un objet que je n’avais pas encore aperçu.",B2
"C’était une huître de dimension extraordinaire, une tridacne gigantesque, un bénitier qui eût contenu un lac d’eau sainte, une vasque dont la largeur dépassait deux mètres, et conséquemment plus grande que celle qui ornait le salon du Nautilus.",B2
Je m’approchai de ce mollusque phénoménal.,B2
"Par son byssus il adhérait à une table de granit, et là il se développait isolément dans les eaux calmes de la grotte.",B2
J’estimai le poids de cette tridacne à trois cents kilogrammes.,B2
"Or une telle huître contient quinze kilos de chair, et il faudrait l’estomac d’un Gargantua pour en absorber quelques douzaines.",B2
Le capitaine Nemo connaissait évidemment l’existence de ce bivalve.,B2
"Ce n’était pas la première fois qu’il le visitait, et je pensai qu’en nous conduisant en cet endroit il voulait seulement nous montrer une curiosité naturelle.",B2
191 me trompais.,B2
Le capitaine Nemo avait un intérêt particulier à constater l’état actuel de cette tridacne.,B2
Les deux valves du mollusque étaient entrouvertes.,B2
"Le capitaine s’approcha et introduisit son poignard entre les coquilles pour les empêcher de se rabattre ; puis, de la main, il souleva la tunique membraneuse et frangée sur ses bords qui formait le manteau de l’animal.",B2
"Là, entre les plis foliacés, je vis une perle libre dont la grosseur égalait celle d’une noix de cocotier.",B2
"Sa forme globuleuse, sa limpidité parfaite, son orient admirable, en faisaient un bijou d’un inestimable prix.",B2
"Emporté par la curiosité, j’étendais la main pour la saisir, pour la peser, pour la palper !",B2
"Mais le capitaine m’arrêta, fit un signe négatif, et, retirant son poignard par un mouvement rapide, il laissa les deux valves se refermer subitement.",B2
Je compris alors quel était le dessein du capitaine Nemo.,B2
"En laissant cette perle enfouie sous le manteau de la tridacne, il lui permettait de s’accroître insensiblement.",B2
Avec chaque année la sécrétion du mollusque y ajoutait de nouvelles couches concentriques.,B2
"Seul, le capitaine connaissait la grotte où « mûrissait » cet admirable fruit de la nature ; seul il relevait, pour ainsi dire, afin de le transporter un jour dans son précieux musée.",B2
"Peut-être même, suivant l’exemple des Chinois et des Indiens, avait-il déterminé la production de cette perle en introduisant sous les plis du mollusque quelque morceau de verre et de métal, qui s’était peu à peu recouvert de la matière nacrée.",B2
"En tout cas, comparant cette perle à celle que je connaissais déjà, à celles qui brillaient dans la collection du capitaine, j’estimai sa valeur à dix millions de francs au moins.",B2
"Superbe curiosité naturelle et non bijou de luxe, car je ne sais quelles oreilles féminines auraient pu la supporter.",B2
La visite à l’opulente tridacne était terminée.,B2
"Le capitaine Nemo quitta la grotte, et nous remontâmes sur le banc de pintadines, au milieu de ces eaux claires que ne troublait pas encore le travail des plongeurs.",B2
"Nous marchions isolément, en véritables flâneurs, chacun s’arrêtant ou s’éloignant au gré de sa fantaisie.",B2
"Pour mon compte, je n’avais plus aucun souci des dangers que mon imagination avait exagérés si ridiculement.",B2
"Le haut-fond se rapprochait sensiblement de la surface de la mer, et bientôt, par un mètre d’eau, ma tête dépassa le niveau océanique.",B2
"Conseil me rejoignit, et, collant sa grosse capsule à la mienne, il me fit des yeux un salut amical.",B2
"Mais ce plateau élevé ne mesurait que quelques toises, et bientôt nous fûmes rentrés dans « notre élément.",B2
» Je crois avoir maintenant le droit de le qualifier ainsi.,B2
"Dix minutes après, le capitaine Nemo s’arrêtait soudain.",B2
Je crus qu’il faisait halte pour retourner sur ses pas.,B2
"D’un geste, il nous ordonna de nous blottir près de lui au fond d’une large anfractuosité.",B2
"Sa main se dirigea vers un point de la masse liquide, et je regardai attentivement.",B2
"192 À cinq mètres de moi, une ombre apparut et s’abaissa jusqu’au sol.",B2
"L’inquiétante idée des requins traversa mon esprit ; mais je me trompais, et, cette fois encore, nous n’avions pas affaire aux monstres de l’Océan.",B2
"C’était un homme, un homme vivant, un Indien, un noir, un pêcheur, un pauvre diable, sans doute, qui venait glaner avant la récolte.",B2
J’apercevais les fonds de son canot mouillé à quelques pieds au-dessus de sa tête.,B2
Il plongeait et remontait successivement.,B2
