sentence,difficulty
"Je me plongeai dans l’étude de ces trésors de conchyliologie, entassés sous les vitrines.",B2
"Je fouillai aussi de vastes herbiers, emplis des plantes marines les plus rares, et qui, quoique desséchées, conservaient leurs admirables couleurs.",B2
"Parmi ces précieuses hydrophytes, je remarquai des cladostèphes verticillées, des padines-paon, des caulerpes à feuilles de vigne, des callithammes granifères, de délicates céramies à teintes écarlates, des agares disposées en éventails, des acétabules, semblables à des champignons très déprimés, et qui furent longtemps classées parmi les zoophytes, enfin toute une série de varechs.",B2
"La journée entière se passa, sans que je fusse honoré de la visite du capitaine Nemo.",B2
Les panneaux du salon ne s’ouvrirent pas.,B2
Peut-être ne voulait-on pas nous blaser sur ces belles choses.,B2
"La direction du Nautilus se maintint à l’est-nord-est, sa vitesse à douze milles, sa profondeur entre cinquante et soixante mètres.",B2
"Le lendemain, 10 novembre, même abandon, même solitude.",B2
Je ne vis personne de l’équipage.,B2
Ned et Conseil passèrent la plus grande partie de la journée avec moi.,B2
Ils s’étonnèrent de l’inexplicable absence du capitaine.,B2
Cet homme singulier était-il malade ?,B2
Voulait-il modifier ses projets à notre égard ?,B2
"Après tout, suivant la remarque de Conseil, nous jouissions d’une entière liberté, nous étions délicatement nourris.",B2
Notre hôte se tenait dans les termes,B2
95 de son traité.,B2
"Nous ne pouvions nous plaindre, et d’ailleurs la singularité même de notre destinée nous réservait de si belles compensations, que nous n’avions pas encore le droit de l’accuser.",B2
"Ce jour-là, je commençai le journal de ces aventures, ce qui m’a permis de les raconter avec la plus scrupuleuse exactitude, et, détail curieux, je l’écrivis sur un papier fabriqué avec la zostère marine.",B2
"Le 11 novembre, de grand matin, l’air frais répandu à l’intérieur du Nautilus m’apprit que nous étions revenus à la surface de l’Océan, afin de renouveler les provisions d’oxygène.",B2
"Je me dirigeai vers l’escalier central, et je montai sur la plate-forme.",B2
Il était six heures.,B2
"Je trouvai le temps couvert, la mer grise, mais calme.",B2
À peine de houle.,B2
"Le capitaine Nemo, que j’espérais rencontrer là, viendrait- il ?",B2
"Je n’aperçus que le timonier, emprisonné dans sa cage de verre.",B2
"Assis sur la saillie produite par la coque du canot, j’aspirai avec délices les émanations salines.",B2
Peu à peu la brume se dissipa sous l’action des rayons solaires.,B2
L’astre radieux débordait de l’horizon oriental.,B2
La mer s’enflamma sous son regard comme une traînée de poudre.,B2
"Les nuages, éparpillés dans les hauteurs, se colorèrent de tons vifs admirablement nuancés, et de nombreuses « langues de chat » annoncèrent du vent pour toute la journée.",B2
Mais que faisait le vent à ce Nautilus que les tempêtes ne pouvaient effrayer !,B2
"J’admirais donc ce joyeux lever de soleil, si gai, si vivifiant, lorsque j’entendis quelqu’un monter sur la plate-forme.",B2
"Je me préparais à saluer le capitaine Nemo, mais ce fut son second qui parut.",B2
Il s’avança sur la plate-forme et ne sembla pas s’apercevoir de ma présence.,B2
"Une puissante lunette aux yeux, il scruta tous les points de l’horizon avec une attention extrême.",B2
"Puis, cet examen fait, il s’approcha du panneau, et prononça une phrase dont voici exactement les termes.",B2
"Je l’ai retenue, car, chaque matin, elle se reproduisit dans des conditions identiques.",B2
Elle était ainsi conçue : « Nautron respoc lorni virch.,B2
"» Ce qu’elle signifiait, je ne saurais le dire.",B2
"Ces mots prononcés, le second redescendit.",B2
Je pensais que le Nautilus allait reprendre sa navigation sous-marine.,B2
"Je regagnai donc le panneau, et par les coursives je revins à ma chambre.",B2
Cinq jours s’écoulèrent ainsi sans que la situation se modifiât.,B2
"Chaque matin, je montais sur la plate-forme, la même phrase était prononcée par le même individu.",B2
Le capitaine Nemo ne paraissait pas.,B2
"96 J’avais pris mon parti de ne plus le voir, quand, le 16 novembre, rentré dans ma chambre avec Ned et Conseil, je trouvai sur la table un billet à mon adresse.",B2
Je l’ouvris d’une main impatiente.,B2
"Il était écrit d’une écriture franche, nette, mais un peu gothique, et qui rappelait les types allemands.",B2
"Ce billet était libellé en ces termes : « Monsieur le professeur Aronnax, à bord du Nautilus.",B2
16 novembre 1867.,B2
Le capitaine Nemo invite monsieur le professeur Aronnax à une partie de chasse qui aura lieu demain matin dans ses forêts de l’île Crespo.,B2
"Il espère que rien ne l’empêchera d’y assister, et il verra avec plaisir ses compagnons se joindre à lui.",B2
"Le commandant du Nautilus, Capitaine Nemo.",B2
» « Une chasse !,B2
 Et dans ses forêts de l’île Crespo !,B2
" Mais il va donc à terre, ce particulier-là ?",B2
reprit Ned Land.,B2
" Cela me paraît clairement indiqué, dis-je en relisant la lettre.",B2
" Eh bien, il faut accepter, répliqua le Canadien.",B2
"Une fois sur la terre ferme, nous aviserons à prendre un parti.",B2
"D’ailleurs, je ne serais pas fâché de manger quelques morceaux de venaison fraîche.",B2
"» Sans chercher à concilier ce qu’il y avait de contradictoire entre l’horreur manifeste du capitaine Nemo pour les continents et les îles, et son invitation de chasser en forêt, je me contentai de répondre : « Voyons d’abord ce que c’est que l’île Crespo.",B2
"» Je consultai le planisphère, et, par 32° 40’de latitude nord et 167° 50’de longitude ouest, je trouvai un îlot qui fut reconnu en 1801 par le capitaine Crespo, et que les anciennes cartes espagnoles nommaient Roca de la Plata, c’est-à-dire « Roche d’Argent ».",B2
"Nous étions donc à dix-huit cents milles environ du point de départ, et la direction un peu modifiée du Nautilus le ramenait vers le sud-est.",B2
Je montrai à mes compagnons ce petit roc perdu au milieu du Pacifique nord.,B2
"« Si le capitaine Nemo va quelquefois à terre, leur dis-je, il choisit du moins des îles absolument désertes !",B2
"» Ned Land hocha la tête sans répondre, puis Conseil et lui me quittèrent.",B2
"Après un souper qui me fut servi par le stewart muet et impassible, je m’endormis, non sans quelque préoccupation.",B2
"97 Le lendemain, 17 novembre, à mon réveil, je sentis que le Nautilus était absolument immobile.",B2
"Je m’habillai lestement, et j’entrai dans le grand salon.",B2
Le capitaine Nemo était là.,B2
"Il m’attendait, se leva, salua, et me demanda s’il nous convenait de l’accompagner.",B2
"Comme il ne fit aucune allusion à son absence pendant ces huit jours, je m’abstins de lui en parler, et je répondis simplement que mes compagnons et moi nous étions prêts à le suivre.",B2
"« Seulement, monsieur, ajoutai-je, je me permettrai de vous adresser une question.",B2
" Adressez, monsieur Aronnax, et si je puis y répondre, j’y répondrai.",B2
" Eh bien, capitaine, comment se fait-il que vous, qui avez rompu toute relation avec la terre, vous possédiez des forêts dans l’île Crespo ?",B2
" Monsieur le professeur, me répondit le capitaine, les forêts que je possède ne demandent au soleil ni sa lumière ni sa chaleur.",B2
"Ni les lions, ni les tigres, ni les panthères, ni aucun quadrupède ne les fréquentent.",B2
Elles ne sont connues que de moi seul.,B2
Elles ne poussent que pour moi seul.,B2
"Ce ne sont point des forêts terrestres, mais des forêts sous-marines.",B2
 Des forêts sous-marines !,B2
" Oui, monsieur le professeur.",B2
 Et vous m’offrez de m’y conduire ?,B2
 À pied ?,B2
 Et même à pied sec.,B2
 En chassant ?,B2
 Le fusil à la main ?,B2
 Le fusil à la main.,B2
» Je regardai le commandant du Nautilus d’un air qui n’avait rien de flatteur pour sa personne.,B2
"« Décidément, il a le cerveau malade, pensais-je.",B2
"Il a eu un accès qui a duré huit jours, et même qui dure encore.",B2
C’est dommage !,B2
Je l’aimais mieux étrange que fou !,B2
"» Cette pensée se lisait clairement sur mon visage, mais le capitaine Nemo se contenta de m’inviter à le suivre, et je le suivis en homme résigné à tout.",B2
"Nous arrivâmes dans la salle à manger, où le déjeuner se trouvait servi.",B2
"« Monsieur Aronnax, me dit le capitaine, je vous prierai de partager mon déjeuner sans façon.",B2
Nous causerons en mangeant.,B2
"Mais, si je vous ai promis une promenade en forêt, je ne me suis point engagé à vous y faire rencontrer un restaurant.",B2
Déjeunez donc en homme qui ne dînera probablement que fort tard.,B2
98 Je fis honneur au repas.,B2
"Il se composait de divers poissons et de tranches d’holoturies, excellents zoophytes, relevés d’algues très apéritives, telle que la Porphyria laciniata et la Laurentia primafetida.",B2
"La boisson se composait d’eau limpide à laquelle, à l’exemple du capitaine, j’ajoutai quelques gouttes d’une liqueur fermentée, extraite, suivant la méthode kamtschatkienne, de l’algue connue sous le nom de « Rhodoménie palmée ».",B2
"Le capitaine Nemo mangea d’abord, sans prononcer une seule parole.",B2
"Puis il me dit : « Monsieur le professeur, quand je vous ai proposé de venir chasser dans mes forêts de Crespo, vous m’avez cru en contradiction avec moi-même.",B2
"Quand je vous ai appris qu’il s’agissait de forêts sous-marines, vous m’avez cru fou.",B2
"Monsieur le professeur, il ne faut jamais juger les hommes à la légère.",B2
" Mais, capitaine, croyez que…  Veuillez m’écouter, et vous verrez si vous devez m’accuser de folie ou de contradiction.",B2
 Je vous écoute.,B2
" Monsieur le professeur, vous le savez aussi bien que moi, l’homme peut vivre sous l’eau à la condition d’emporter avec lui sa provision d’air respirable.",B2
"Dans les travaux sous-marins, l’ouvrier, revêtu d’un vêtement imperméable et la tête emprisonnée dans une capsule de métal, reçoit l’air de l’extérieur au moyen de pompes foulantes et de régulateurs d’écoulement.",B2
" C’est l’appareil des scaphandres, dis-je.",B2
" En effet, mais dans ces conditions, l’homme n’est pas libre.",B2
"Il est rattaché à la pompe qui lui envoie l’air par un tuyau de caoutchouc, véritable chaîne qui le rive à la terre, et si nous étions ainsi retenus au Nautilus, nous ne pourrions aller loin.",B2
 Et le moyen d’être libre ?,B2
" C’est d’employer l’appareil Rouquayrol-Denayrouze, imaginé par deux de vos compatriotes, mais que j’ai perfectionné pour mon usage, et qui vous permettra de vous risquer dans ces nouvelles conditions physiologiques, sans que vos organes en souffrent aucunement.",B2
"Il se compose d’un réservoir en tôle épaisse, dans lequel j’emmagasine l’air sous une pression de cinquante atmosphères.",B2
"Ce réservoir se fixe sur le dos au moyen de bretelles, comme un sac de soldat.",B2
"Sa partie supérieure forme une boîte dont l’air, maintenu par un mécanisme à soufflet, ne peut s’échapper qu’à sa tension normale.",B2
"Dans l’appareil Rouquayrol, tel qu’il est employé, deux tuyaux en caoutchouc, partant de cette boite, viennent aboutir à une sorte de pavillon qui emprisonne le nez et la bouche de l’opérateur ; l’un sert à l’introduction de l’air inspiré, l’autre à l’issue de l’air expiré, et la langue ferme celui-ci ou celui-là, suivant les besoins de la respiration.",B2
Mais moi qui affronte des,B2
"99 pressions considérables au fond des mers, j’ai dû enfermer ma tête, comme celles des scaphandres, dans une sphère de cuivre, et c’est à cette sphère qu’aboutissent les deux tuyaux inspirateurs et expirateurs.",B2
" Parfaitement, capitaine Nemo.",B2
"Cependant, l’air que vous emportez doit s’user vite, et dès qu’il ne contient plus que quinze pour cent d’oxygène, il devient irrespirable.",B2
" Sans doute, mais je vous l’ai dit, monsieur Aronnax, les pompes du Nautilus me permettent de l’emmagasiner sous une pression considérable, et, dans ces conditions, le réservoir de l’appareil peut fournir de l’air respirable pendant neuf ou dix heures.",B2
" Je n’ai plus d’objection à faire, répondis-je.",B2
Je vous demanderai seulement comment vous éclairez votre route au fond de l’Océan.,B2
" Avec l’appareil Ruhmkorff, monsieur Aronnax.",B2
"Si le premier se porte sur le dos, le second s’attache à la ceinture.",B2
"Il se compose d’une pile de Bunsen que je mets en activité, non avec du bichromate de potasse que je ne pourrais me procurer, mais avec ce sodium dont la mer est saturée.",B2
"Une bobine d’induction recueille l’électricité produite, et la dirige vers une lanterne d’une disposition particulière.",B2
Dans cette lanterne se trouve un serpentin de verre qui contient seulement un résidu de gaz carbonique.,B2
"Quand l’appareil fonctionne, ce gaz devient lumineux, en donnant une lumière blanchâtre et continue.",B2
"Ainsi pourvu, je respire et je vois.",B2
" Capitaine Nemo, à toutes mes objections, vous faites de si écrasantes réponses que je n’ose plus douter.",B2
"Cependant, si je suis forcé d’admettre les appareils Rouquayrol et Ruhmkorff, je demande à faire des réserves pour le fusil dont vous voulez m’armer.",B2
" Mais ce n’est point un fusil à poudre, répondit le capitaine.",B2
 C’est donc un fusil à vent ?,B2
"Comment voulez-vous que je fabrique de la poudre à mon bord, n’ayant ni salpêtre, ni soufre, ni charbon ?",B2
" D’ailleurs, dis-je, pour tirer utilement sous l’eau, dans ce milieu huit cent cinquante-cinq fois plus dense que l’air, il faudrait vaincre une résistance considérable.",B2
 Ce ne serait pas une raison.,B2
"Il existe certains canons, perfectionnés après Fulton par les Anglais Philippe Coles et Burley, par le Français Furcy, par l’Italien Landi et qui, munis d’un système particulier de fermeture, peuvent tirer dans ces conditions.",B2
"Mais, je vous le répète, n’ayant pas de poudre, je l’ai remplacée par de l’air à haute pression, que les pompes du Nautilus me fournissent abondamment.",B2
 Cet air doit rapidement s’user.,B2
" Eh bien, n’ai-je pas mon réservoir Rouquayrol, qui peut, au besoin, m’en fournir ?",B2
Il suffit pour cela d’un robinet ad hoc.,B2
"100 Aronnax, vous verrez par vous-même que, pendant ces chasses sous- marines, on ne fait pas grande dépense d’air ni de balles.",B2
" Cependant, il me semble que dans cette demi-obscurité, et au milieu de ce liquide très dense par rapport à l’atmosphère, les coups ne peuvent porter loin et sont difficilement mortels ?",B2
" Monsieur, avec ce fusil, tous les coups sont mortels, au contraire, et dès qu’un animal est touché, si légèrement que ce soit, il tombe foudroyé.",B2
" Parce que ce ne sont pas des balles ordinaires que ce fusil lance, mais de petites capsules de verre inventées par le chimiste autrichien Leniebroek, et dont j’ai un approvisionnement considérable.",B2
"Ces capsules de verre, recouvertes d’une armature d’acier et alourdies par un culot de plomb, sont de véritables petites bouteilles de Leyde, dans lesquelles l’électricité est forcée à une très haute tension.",B2
"Au plus léger choc, elles se déchargent, et l’animal, si puissant qu’il soit, tombe mort.",B2
"J’ajouterai que ces capsules ne sont pas plus grosses que du numéro quatre, et que la charge d’un fusil ordinaire pourrait en contenir dix.",B2
" Je ne discute plus, répondis-je en me levant de table, et je n’ai plus qu’à prendre mon fusil.",B2
"D’ailleurs, où vous irez, j’irai.",B2
"» Le capitaine me conduisit vers l’arrière du Nautilus, et, en passant devant la cabine de Ned et de Conseil, j’appelai mes deux compagnons, qui nous suivirent aussitôt.",B2
"Puis nous arrivâmes à une cellule située en abord, près de la chambre des machines, et dans laquelle nous devions revêtir nos vêtements de promenade.",B2
"101 XVI Promenade en plaine Cette cellule était, à proprement parler, l’arsenal et le vestiaire du Nautilus.",B2
"Une douzaine d’appareils de scaphandres, suspendus à la paroi, attendaient les promeneurs.",B2
"Ned Land, en les voyant, manifesta une répugnance évidente à s’en revêtir.",B2
"« Mais, mon brave Ned, lui dis-je, les forêts de l’île Crespo ne sont que des forêts sous-marines !",B2
"fit le harponneur désappointé, qui voyait s’évanouir ses rêves de viande fraîche.",B2
"Et vous, monsieur Aronnax, vous allez vous introduire dans ces habits-là ?",B2
" Il le faut bien, maître Ned.",B2
" Libre à vous, monsieur, répondit le harponneur, haussant les épaules, mais quant à moi, à moins qu’on ne m’y force, je n’entrerai jamais là-dedans.",B2
" On ne vous forcera pas, maître Ned, dit le capitaine Nemo.",B2
 Et Conseil va se risquer ?,B2
" Je suis monsieur partout où va monsieur, » répondit Conseil.",B2
"Sur un appel du capitaine, deux hommes de l’équipage vinrent nous aider à revêtir ces lourds vêtements imperméables, faits en caoutchouc sans couture, et préparés de manière à supporter des pressions considérables.",B2
On eût dit une armure à la fois souple et résistante.,B2
Ces vêtements formaient pantalon et veste.,B2
"Le pantalon se terminait par d’épaisses chaussures, garnies de lourdes semelles de plomb.",B2
"Le tissu de la veste était maintenu par des lamelles de cuivre qui cuirassaient la poitrine, la défendaient contre la poussée des eaux, et laissaient les poumons fonctionner librement ; ses manches finissaient en forme de gants assouplis, qui ne contrariaient aucunement les mouvements de la main.",B2
"Il y avait loin, on le voit, de ces scaphandres perfectionnés aux vêtements informes, tels que les cuirasses de liège, les soubrevestes, les habits de mer, les coffres, etc., qui furent inventés et prônés dans le XVIIIe siècle.",B2
"Le capitaine Nemo, un de ses compagnons,  sorte d’Hercule, qui devait être d’une force prodigieuse,  Conseil et moi, nous eûmes bientôt revêtu ces habits de scaphandres.",B2
Il ne s’agissait plus que d’emboîter notre tête dans sa sphère métallique.,B2
"Mais, avant de procéder à cette opération, je demandai au capitaine la permission d’examiner les fusils qui nous étaient destinés.",B2
"102 L’un des hommes du Nautilus me présenta un fusil simple dont la crosse, faite en tôle d’acier et creuse à l’intérieur, était d’assez grande dimension.",B2
"Elle servait de réservoir à l’air comprimé, qu’une soupape, manœuvrée par une gâchette, laissait échapper dans le tube de métal.",B2
"Une boite à projectiles, évidée dans l’épaisseur de la crosse, renfermait une vingtaine de balles électriques, qui, au moyen d’un ressort, se plaçaient automatiquement dans le canon du fusil.",B2
"Dès qu’un coup était tiré, l’autre était prêt à partir.",B2
"« Capitaine Nemo, dis-je, cette arme est parfaite et d’un maniement facile.",B2
Je ne demande plus qu’à l’essayer.,B2
Mais comment allons-nous gagner le fond de la mer ?,B2
" En ce moment, monsieur le professeur, le Nautilus est échoué par dix mètres d’eau, et nous n’aurons plus qu’à partir.",B2
 Comment sortirons-nous ?,B2
 Vous l’allez voir.,B2
» Le capitaine Nemo introduisit sa tête dans la calotte sphérique.,B2
"Conseil et moi, nous en fîmes autant, non sans avoir entendu le Canadien nous lancer un « bonne chasse » ironique.",B2
"Le haut de notre vêtement était terminé par un collet de cuivre taraudé, sur lequel se vissait ce casque de métal.",B2
"Trois trous, protégés par des verres épais, permettaient de voir dans toutes les directions, rien qu’en tournant la tête à l’intérieur de cette sphère.",B2
"Dès qu’elle fut en place, les appareils Rouquayrol, placés sur notre dos, commencèrent à fonctionner, et, pour mon compte, je respirai à l’aise.",B2
"La lampe Ruhmkorff suspendue à ma ceinture, le fusil à la main, j’étais prêt à partir.",B2
"Mais, pour être franc, emprisonné dans ces lourds vêtements et cloué au tillac par mes semelles de plomb, il m’eût été impossible de faire un mouvement.",B2
"Mais ce cas était prévu, et je sentis que l’on me poussait dans une petite chambre contiguë au vestiaire.",B2
"Mes compagnons, également remorqués, me suivaient.",B2
"J’entendis une porte, munie d’obturateurs, se refermer sur nous, et une profonde obscurité nous enveloppa.",B2
"Après quelques minutes, un vif sifflement parvint à mon oreille.",B2
Je sentis une certaine impression de froid monter de mes pieds à ma poitrine.,B2
"Évidemment, de l’intérieur du bateau, on avait, par un robinet, donné entrée à l’eau extérieure qui nous envahissait, et dont cette chambre fut bientôt remplie.",B2
"Une seconde porte, percée dans le flanc du Nautilus, s’ouvrit alors.",B2
Un demi-jour nous éclaira.,B2
"Un instant après, nos pieds foulaient le fond de la mer.",B2
"Et maintenant, comment pourrais-je retracer les impressions que m’a laissées cette promenade sous les eaux ?",B2
Les mots sont impuissants à raconter de telles merveilles !,B2
Quand le pinceau lui-même est inhabile à,B2
"103 rendre les effets particuliers à l’élément liquide, comment la plume saurait- elle les reproduire ?",B2
"Le capitaine Nemo marchait en avant, et son compagnon nous suivait à quelques pas en arrière.",B2
"Conseil et moi, nous restions l’un près de l’autre, comme si un échange de paroles eût été possible à travers nos carapaces métalliques.",B2
"Je ne sentais déjà plus la lourdeur de mes vêtements, de mes chaussures, de mon réservoir d’air, ni le poids de cette épaisse sphère, au milieu de laquelle ma tête ballottait comme une amande dans sa coquille.",B2
"Tous ces objets, plongés dans l’eau, perdaient une partie de leur poids égale à celui du liquide déplacé, et je me trouvais très bien de cette loi physique reconnue par Archimède.",B2
"Je n’étais plus une masse inerte, et j’avais une liberté de mouvement relativement grande.",B2
"La lumière, qui éclairait le sol jusqu’à trente pieds au-dessous de la surface de l’Océan, m’étonna par sa puissance.",B2
Les rayons solaires traversaient aisément cette masse aqueuse et en dissipaient la coloration.,B2
Je distinguais nettement les objets à une distance de cent mètres.,B2
"Au- delà, les fonds se nuançaient des fines dégradations de l’outremer, puis ils bleuissaient dans les lointains, et s’effaçaient au milieu d’une vague obscurité.",B2
"Véritablement, cette eau qui m’entourait n’était qu’une sorte d’air, plus dense que l’atmosphère terrestre, mais presque aussi diaphane.",B2
"Au- dessus de moi, j’apercevais la calme surface de la mer.",B2
"Nous marchions sur un sable fin, uni, non ridé comme celui des plages qui conserve l’empreinte de la houle.",B2
"Ce tapis éblouissant, véritable réflecteur, repoussait les rayons du soleil avec une surprenante intensité.",B2
"De là, cette immense réverbération qui pénétrait toutes les molécules liquides.",B2
"Serais- je cru si j’affirme qu’à cette profondeur de trente pieds, j’y voyais comme en plein jour ?",B2
"Pendant un quart d’heure, je foulai ce sable ardent, semé d’une impalpable poussière de coquillages.",B2
"La coque du Nautilus, dessinée comme un long écueil, disparaissait peu à peu ; mais son fanal, lorsque la nuit se serait faite au milieu des eaux, devait faciliter notre retour à bord, en projetant ses rayons avec une netteté parfaite.",B2
Effet difficile à comprendre pour qui n’a vu que sur terre ces nappes blanchâtres si vivement accusées.,B2
"Là, la poussière dont l’air est saturé leur donne l’apparence d’un brouillard lumineux ; mais sur mer, comme sous mer, ces traits électriques se transmettent avec une incomparable pureté.",B2
"Cependant, nous allions toujours, et la vaste plaine de sable semblait être sans bornes.",B2
"J’écartais de la main les rideaux liquides qui se refermaient derrière moi, et la trace de mes pas s’effaçait soudain sous la pression des eaux.",B2
"104 Bientôt quelques formes d’objets, à peine estompés dans l’éloignement, se dessinèrent à mes yeux.",B2
"Je reconnus de magnifiques premiers plans de rochers, tapissés de zoophytes du plus bel échantillon, et je fus tout d’abord frappé d’un effet spécial à ce milieu.",B2
Il était alors dix heures du matin.,B2
"Les rayons du soleil frappaient la surface des flots sous un angle assez oblique, et au contact de leur lumière décomposée par la réfraction comme à travers un prisme, fleurs, rochers, plantules, coquillages, polypes, se nuançaient sur leurs bords des sept couleurs du spectre solaire.",B2
"C’était une merveille, une fête des yeux, que cet enchevêtrement de tons colorés, une véritable kaléidoscopie de vert, de jaune, d’orange, de violet, d’indigo, de bleu, en un mot, toute la palette d’un coloriste enragé !",B2
"Que ne pouvais-je, communiquer à Conseil les vives sensations qui me montaient au cerveau, et rivaliser avec lui d’interjections admiratives !",B2
"Que ne savais-je, comme le capitaine Nemo et son compagnon, échanger mes pensées au moyen de signes convenus !",B2
"Aussi, faute de mieux, je me parlais à moi-même, je criais dans la boîte de cuivre qui coiffait ma tête, dépensant peut-être en vaines paroles plus d’air qu’il ne convenait.",B2
"Devant ce splendide spectacle, Conseil s’était arrêté comme moi.",B2
